{
  "$schema": "https://json-schema.org/draft/2020-12/schema",
  "$id": "https://anidiagram.dev/schemas/diagram-script-v0.3.schema.json",
  "title": "DiagramScript v0.3",
  "type": "object",
  "required": ["version", "nodes"],
  "properties": {
    "planning": {"$ref": "planning-diagnostics-v0.1.schema.json"},
    "version": {"const": "0.3"},
    "preset": {"type": "string"},
    "motion": {"$ref": "#/$defs/motion"},
    "motion_policy": {"$ref": "#/$defs/motion_policy"},
    "canvas": {
      "type": "object",
      "properties": {
        "width": {"type": "integer", "minimum": 1},
        "height": {"type": "integer", "minimum": 1}
      }
    },
    "style": {"type": "string"},
    "title": {
      "type": "object",
      "properties": {
        "text": {"type": "string"},
        "subtitle": {"type": "string"}
      }
    },
    "groups": {"type": "array", "items": {"$ref": "#/$defs/group"}},
    "nodes": {"type": "array", "minItems": 1, "items": {"$ref": "#/$defs/node"}},
    "edges": {"type": "array", "items": {"$ref": "#/$defs/edge"}}
  },
    "$defs": {
    "role": {"enum": ["actor", "source", "process", "agent", "memory", "tool", "output", "risk", "neutral"]},
    "route": {"enum": ["curved", "straight", "hv", "vh", "orthogonal", "points"]},
    "icon": {"enum": ["database", "file", "folder", "api", "cloud", "search", "shield", "agent", "operator", "token", "memory", "tool", "output"]},
    "node_shape": {"enum": ["rect", "decision"]},
    "point": {
      "type": "array",
      "prefixItems": [{"type": "number"}, {"type": "number"}],
      "items": false,
      "minItems": 2,
      "maxItems": 2
    },
    "bounds": {
      "type": "array",
      "prefixItems": [{"type": "number"}, {"type": "number"}, {"type": "number"}, {"type": "number"}],
      "items": false,
      "minItems": 4,
      "maxItems": 4
    },
    "effect": {
      "type": "object",
      "properties": {
        "preset": {"type": "string"},
        "line": {"type": "string"},
        "particle": {"type": "string"},
        "trail": {"oneOf": [{"type": "string"}, {"type": "boolean"}]},
        "particle_count": {"type": "integer", "minimum": 0},
        "trail_count": {"type": "integer", "minimum": 0},
        "entry": {"type": "string"},
        "accent": {"type": "string"},
        "icon": {"type": "string"},
        "icon_motion": {"type": "string"}
      }
    },
    "motion_channel": {
      "oneOf": [
        {"type": "string"},
        {"$ref": "#/$defs/effect"}
      ]
    },
    "node": {
      "type": "object",
      "required": ["id", "position", "size"],
      "properties": {
        "id": {"type": "string", "minLength": 1},
        "label": {"type": "string"},
        "caption": {"type": "string"},
        "position": {"$ref": "#/$defs/point"},
        "size": {"$ref": "#/$defs/point"},
        "shape": {"$ref": "#/$defs/node_shape"},
        "role": {"$ref": "#/$defs/role"},
        "icon": {"$ref": "#/$defs/icon"},
        "effect": {"$ref": "#/$defs/effect"},
        "step": {"type": "integer", "minimum": 1},
        "radius": {"type": "number", "exclusiveMinimum": 0},
        "fill": {"type": "string"},
        "stroke": {"type": "string"},
        "stroke_width": {"type": "number", "exclusiveMinimum": 0}
      }
    },
    "edge": {
      "type": "object",
      "required": ["from", "to"],
      "properties": {
        "from": {"type": "string", "minLength": 1},
        "to": {"type": "string", "minLength": 1},
        "label": {"type": "string"},
        "role": {"$ref": "#/$defs/role"},
        "route": {"$ref": "#/$defs/route"},
        "effect": {"$ref": "#/$defs/effect"},
        "step": {"type": "integer", "minimum": 1},
        "points": {"type": "array", "minItems": 2, "items": {"$ref": "#/$defs/point"}},
        "duration": {"type": "string"},
        "delay": {"type": "number"},
        "animated": {"type": "boolean"},
        "width": {"type": "number", "exclusiveMinimum": 0},
        "stroke": {"type": "string"}
      }
    },
    "group": {
      "type": "object",
      "required": ["id", "bounds"],
      "properties": {
        "id": {"type": "string", "minLength": 1},
        "label": {"type": "string"},
        "members": {"type": "array", "uniqueItems": true, "items": {"type": "string", "minLength": 1}},
        "bounds": {"$ref": "#/$defs/bounds"},
        "role": {"$ref": "#/$defs/role"},
        "effect": {"$ref": "#/$defs/effect"},
        "fill": {"type": "string"},
        "stroke": {"type": "string"}
      }
    },
    "motion": {
      "type": "object",
      "properties": {
        "profile": {"enum": ["off", "subtle", "normal", "expressive", "teaching", "runtime-loop"]},
        "sequence": {"enum": ["simultaneous", "step-stagger", "layered", "staged", "loop"]},
        "ease": {"enum": ["linear", "calm", "snappy", "back-out", "elastic", "spring"]},
        "stagger": {"type": "number", "minimum": 0},
        "duration_scale": {"type": "number", "exclusiveMinimum": 0},
        "intensity": {"type": "number", "minimum": 0},
        "node": {"$ref": "#/$defs/motion_channel"},
        "edge": {"$ref": "#/$defs/motion_channel"},
        "group": {"$ref": "#/$defs/motion_channel"},
        "title": {"$ref": "#/$defs/motion_channel"},
        "reduced_motion": {"enum": ["static", "subtle", "pause"]}
      }
    },
    "motion_policy": {
      "type": "object",
      "properties": {
        "profile": {"enum": ["unrestricted", "readable", "focused", "expressive", "readable-runtime"]},
        "motion_area": {"enum": ["auto", "micro", "small", "medium", "unrestricted"]},
        "max_active_flow_edges": {"type": "integer", "minimum": 0},
        "max_particle_edges": {"type": "integer", "minimum": 0},
        "particle_count_per_edge": {"type": "integer", "minimum": 0},
        "flow_trail_count": {"type": "integer", "minimum": 0},
        "max_active_pulse_nodes": {"type": "integer", "minimum": 0},
        "pulse_mode": {"enum": ["all", "rotate"]},
        "max_scanning_groups": {"type": "integer", "minimum": 0}
      }
    }
  }
}
